artifacts/env_time_focus_period_ms_full5/history_ablation_summary.json

{
  "config": {
    "artifact_dir": "artifacts\\dynamic_hlb_period_ms_full5",
    "analysis_unit": "period",
    "window_specs": [
      [
        6,
        1
      ],
      [
        6,
        3
      ],
      [
        9,
        1
      ],
      [
        9,
        3
      ]
    ],
    "history_periods": [
      1,
      2,
      3
    ],
    "repeats_used": [
      0,
      1,
      2,
      3,
      4
    ],
    "retrain_epochs": null,
    "retrain_patience": null
  },
  "summary": [
    {
      "variant": "exclude_last_k_1",
      "history_mode": "exclude_last_k",
      "history_periods": 1.0,
      "landmark": 6,
      "pred_horizon": 1,
      "eligible_n_mean": 14.0,
      "eligible_n_std": 0.0,
      "future_event_n_mean": 0.6,
      "future_event_n_std": 0.5477225575051661,
      "ctd_mean": 0.5641025641025641,
      "ctd_std": 0.43740313100594824,
      "bstd_mean": 0.044359993147795165,
      "bstd_std": 0.03062200885579563
    },
    {
      "variant": "exclude_last_k_1",
      "history_mode": "exclude_last_k",
      "history_periods": 1.0,
      "landmark": 6,
      "pred_horizon": 3,
      "eligible_n_mean": 14.0,
      "eligible_n_std": 0.0,
      "future_event_n_mean": 2.0,
      "future_event_n_std": 0.7071067811865476,
      "ctd_mean": 0.5681758241758242,
      "ctd_std": 0.09730512031150206,
      "bstd_mean": 0.13102344703632782,
      "bstd_std": 0.0258661407715269
    },
    {
      "variant": "exclude_last_k_1",
      "history_mode": "exclude_last_k",
      "history_periods": 1.0,
      "landmark": 9,
      "pred_horizon": 1,
      "eligible_n_mean": 12.0,
      "eligible_n_std": 0.7071067811865476,
      "future_event_n_mean": 0.6,
      "future_event_n_std": 0.5477225575051661,
      "ctd_mean": 0.29292929292929293,
      "ctd_std": 0.0974106137474036,
      "bstd_mean": 0.05166986823649444,
      "bstd_std": 0.035474214206583185
    },
    {
      "variant": "exclude_last_k_1",
      "history_mode": "exclude_last_k",
      "history_periods": 1.0,
      "landmark": 9,
      "pred_horizon": 3,
      "eligible_n_mean": 12.0,
      "eligible_n_std": 0.7071067811865476,
      "future_event_n_mean": 2.4,
      "future_event_n_std": 0.8944271909999159,
      "ctd_mean": 0.7174773981585398,
      "ctd_std": 0.33139603084098207,
      "bstd_mean": 0.9340282959610887,
      "bstd_std": 0.9679620350045761
    },
    {
      "variant": "exclude_last_k_2",
      "history_mode": "exclude_last_k",
      "history_periods": 2.0,
      "landmark": 6,
      "pred_horizon": 1,
      "eligible_n_mean": 14.0,
      "eligible_n_std": 0.0,
      "future_event_n_mean": 0.6,
      "future_event_n_std": 0.5477225575051661,
      "ctd_mean": 0.5384615384615384,
      "ctd_std": 0.4282895663715402,
      "bstd_mean": 0.04604774056600966,
      "bstd_std": 0.035603654176938275
    },
    {
      "variant": "exclude_last_k_2",
      "history_mode": "exclude_last_k",
      "history_periods": 2.0,
      "landmark": 6,
      "pred_horizon": 3,
      "eligible_n_mean": 14.0,
      "eligible_n_std": 0.0,
      "future_event_n_mean": 2.0,
      "future_event_n_std": 0.7071067811865476,
      "ctd_mean": 0.5578901098901099,
      "ctd_std": 0.10737760701874187,
      "bstd_mean": 0.13757947864380818,
      "bstd_std": 0.02715837084464614
    },
    {
      "variant": "exclude_last_k_2",
      "history_mode": "exclude_last_k",
      "history_periods": 2.0,
      "landmark": 9,
      "pred_horizon": 1,
      "eligible_n_mean": 12.0,
      "eligible_n_std": 0.7071067811865476,
      "future_event_n_mean": 0.6,
      "future_event_n_std": 0.5477225575051661,
      "ctd_mean": 0.47222222222222227,
      "ctd_std": 0.3217988257223796,
      "bstd_mean": 0.05595095590438357,
      "bstd_std": 0.04263291834759182
    },
    {
      "variant": "exclude_last_k_2",
      "history_mode": "exclude_last_k",
      "history_periods": 2.0,
      "landmark": 9,
      "pred_horizon": 3,
      "eligible_n_mean": 12.0,
      "eligible_n_std": 0.7071067811865476,
      "future_event_n_mean": 2.4,
      "future_event_n_std": 0.8944271909999159,
      "ctd_mean": 0.7193200487408057,
      "ctd_std": 0.33324525202916466,
      "bstd_mean": 1.0716108165753,
      "bstd_std": 1.2344395527683873
    },
    {
      "variant": "exclude_last_k_3",
      "history_mode": "exclude_last_k",
      "history_periods": 3.0,
      "landmark": 6,
      "pred_horizon": 1,
      "eligible_n_mean": 14.0,
      "eligible_n_std": 0.0,
      "future_event_n_mean": 0.6,
      "future_event_n_std": 0.5477225575051661,
      "ctd_mean": 0.5384615384615384,
      "ctd_std": 0.4282895663715402,
      "bstd_mean": 0.04517498632483215,
      "bstd_std": 0.03163303843432875
    },
    {
      "variant": "exclude_last_k_3",
      "history_mode": "exclude_last_k",
      "history_periods": 3.0,
      "landmark": 6,
      "pred_horizon": 3,
      "eligible_n_mean": 14.0,
      "eligible_n_std": 0.0,
      "future_event_n_mean": 2.0,
      "future_event_n_std": 0.7071067811865476,
      "ctd_mean": 0.5498901098901099,
      "ctd_std": 0.1288710700152426,
      "bstd_mean": 0.13213382940058485,
      "bstd_std": 0.02644172432692687
    },
    {
      "variant": "exclude_last_k_3",
      "history_mode": "exclude_last_k",
      "history_periods": 3.0,
      "landmark": 9,
      "pred_horizon": 1,
      "eligible_n_mean": 12.0,
      "eligible_n_std": 0.7071067811865476,
      "future_event_n_mean": 0.6,
      "future_event_n_std": 0.5477225575051661,
      "ctd_mean": 0.37121212121212127,
      "ctd_std": 0.3280399256759237,
      "bstd_mean": 0.05038288116637189,
      "bstd_std": 0.03747608589836551
    },
    {
      "variant": "exclude_last_k_3",
      "history_mode": "exclude_last_k",
      "history_periods": 3.0,
      "landmark": 9,
      "pred_horizon": 3,
      "eligible_n_mean": 12.0,
      "eligible_n_std": 0.7071067811865476,
      "future_event_n_mean": 2.4,
      "future_event_n_std": 0.8944271909999159,
      "ctd_mean": 0.7282350302585269,
      "ctd_std": 0.32123565908005003,
      "bstd_mean": 0.9482393138045149,
      "bstd_std": 0.9613013601955211
    },
    {
      "variant": "full",
      "history_mode": "full",
      "history_periods": 0.0,
      "landmark": 6,
      "pred_horizon": 1,
      "eligible_n_mean": 14.0,
      "eligible_n_std": 0.0,
      "future_event_n_mean": 0.6,
      "future_event_n_std": 0.5477225575051661,
      "ctd_mean": 0.5384615384615384,
      "ctd_std": 0.4803844614152614,
      "bstd_mean": 0.04216916161454997,
      "bstd_std": 0.03338708389427912
    },
    {
      "variant": "full",
      "history_mode": "full",
      "history_periods": 0.0,
      "landmark": 6,
      "pred_horizon": 3,
      "eligible_n_mean": 14.0,
      "eligible_n_std": 0.0,
      "future_event_n_mean": 2.0,
      "future_event_n_std": 0.7071067811865476,
      "ctd_mean": 0.5624615384615386,
      "ctd_std": 0.09364164349502684,
      "bstd_mean": 0.13311708053850796,
      "bstd_std": 0.024663032067098446
    },
    {
      "variant": "full",
      "history_mode": "full",
      "history_periods": 0.0,
      "landmark": 9,
      "pred_horizon": 1,
      "eligible_n_mean": 12.0,
      "eligible_n_std": 0.7071067811865476,
      "future_event_n_mean": 0.6,
      "future_event_n_std": 0.5477225575051661,
      "ctd_mean": 0.4166666666666667,
      "ctd_std": 0.2692326612714676,
      "bstd_mean": 0.05809620477248727,
      "bstd_std": 0.04215568805528352
    },
    {
      "variant": "full",
      "history_mode": "full",
      "history_periods": 0.0,
      "landmark": 9,
      "pred_horizon": 3,
      "eligible_n_mean": 12.0,
      "eligible_n_std": 0.7071067811865476,
      "future_event_n_mean": 2.4,
      "future_event_n_std": 0.8944271909999159,
      "ctd_mean": 0.6951013499763438,
      "ctd_std": 0.27008329312781093,
      "bstd_mean": 0.9936863852759558,
      "bstd_std": 1.1233000212188153
    },
    {
      "variant": "only_last_k_1",
      "history_mode": "only_last_k",
      "history_periods": 1.0,
      "landmark": 6,
      "pred_horizon": 1,
      "eligible_n_mean": 14.0,
      "eligible_n_std": 0.0,
      "future_event_n_mean": 0.6,
      "future_event_n_std": 0.5477225575051661,
      "ctd_mean": 0.5128205128205129,
      "ctd_std": 0.47000776358521434,
      "bstd_mean": 0.04654601033114926,
      "bstd_std": 0.035137083012053934
    },
    {
      "variant": "only_last_k_1",
      "history_mode": "only_last_k",
      "history_periods": 1.0,
      "landmark": 6,
      "pred_horizon": 3,
      "eligible_n_mean": 14.0,
      "eligible_n_std": 0.0,
      "future_event_n_mean": 2.0,
      "future_event_n_std": 0.7071067811865476,
      "ctd_mean": 0.5277362637362637,
      "ctd_std": 0.07669202347964699,
      "bstd_mean": 0.1397589169191901,
      "bstd_std": 0.02894787394635689
    },
    {
      "variant": "only_last_k_1",
      "history_mode": "only_last_k",
      "history_periods": 1.0,
      "landmark": 9,
      "pred_horizon": 1,
      "eligible_n_mean": 12.0,
      "eligible_n_std": 0.7071067811865476,
      "future_event_n_mean": 0.6,
      "future_event_n_std": 0.5477225575051661,
      "ctd_mean": 0.44696969696969696,
      "ctd_std": 0.4016580649033807,
      "bstd_mean": 0.058956828967232935,
      "bstd_std": 0.0363279509760499
    },
    {
      "variant": "only_last_k_1",
      "history_mode": "only_last_k",
      "history_periods": 1.0,
      "landmark": 9,
      "pred_horizon": 3,
      "eligible_n_mean": 12.0,
      "eligible_n_std": 0.7071067811865476,
      "future_event_n_mean": 2.4,
      "future_event_n_std": 0.8944271909999159,
      "ctd_mean": 0.6062584620503987,
      "ctd_std": 0.36463647736895327,
      "bstd_mean": 1.0295610844925267,
      "bstd_std": 1.1440439359248704
    },
    {
      "variant": "only_last_k_2",
      "history_mode": "only_last_k",
      "history_periods": 2.0,
      "landmark": 6,
      "pred_horizon": 1,
      "eligible_n_mean": 14.0,
      "eligible_n_std": 0.0,
      "future_event_n_mean": 0.6,
      "future_event_n_std": 0.5477225575051661,
      "ctd_mean": 0.5128205128205129,
      "ctd_std": 0.47000776358521434,
      "bstd_mean": 0.046815837856530776,
      "bstd_std": 0.03447494172949245
    },
    {
      "variant": "only_last_k_2",
      "history_mode": "only_last_k",
      "history_periods": 2.0,
      "landmark": 6,
      "pred_horizon": 3,
      "eligible_n_mean": 14.0,
      "eligible_n_std": 0.0,
      "future_event_n_mean": 2.0,
      "future_event_n_std": 0.7071067811865476,
      "ctd_mean": 0.498021978021978,
      "ctd_std": 0.08483858103922805,
      "bstd_mean": 0.1377862958666176,
      "bstd_std": 0.031191830234923973
    },
    {
      "variant": "only_last_k_2",
      "history_mode": "only_last_k",
      "history_periods": 2.0,
      "landmark": 9,
      "pred_horizon": 1,
      "eligible_n_mean": 12.0,
      "eligible_n_std": 0.7071067811865476,
      "future_event_n_mean": 0.6,
      "future_event_n_std": 0.5477225575051661,
      "ctd_mean": 0.23484848484848486,
      "ctd_std": 0.047310590896957556,
      "bstd_mean": 0.05330123851574011,
      "bstd_std": 0.03215145507622498
    },
    {
      "variant": "only_last_k_2",
      "history_mode": "only_last_k",
      "history_periods": 2.0,
      "landmark": 9,
      "pred_horizon": 3,
      "eligible_n_mean": 12.0,
      "eligible_n_std": 0.7071067811865476,
      "future_event_n_mean": 2.4,
      "future_event_n_std": 0.8944271909999159,
      "ctd_mean": 0.6388602090142441,
      "ctd_std": 0.3995398364646992,
      "bstd_mean": 1.0808495064310206,
      "bstd_std": 1.1890412575367326
    },
    {
      "variant": "only_last_k_3",
      "history_mode": "only_last_k",
      "history_periods": 3.0,
      "landmark": 6,
      "pred_horizon": 1,
      "eligible_n_mean": 14.0,
      "eligible_n_std": 0.0,
      "future_event_n_mean": 0.6,
      "future_event_n_std": 0.5477225575051661,
      "ctd_mean": 0.5384615384615384,
      "ctd_std": 0.4282895663715402,
      "bstd_mean": 0.044857467862030515,
      "bstd_std": 0.03057816626165672
    },
    {
      "variant": "only_last_k_3",
      "history_mode": "only_last_k",
      "history_periods": 3.0,
      "landmark": 6,
      "pred_horizon": 3,
      "eligible_n_mean": 14.0,
      "eligible_n_std": 0.0,
      "future_event_n_mean": 2.0,
      "future_event_n_std": 0.7071067811865476,
      "ctd_mean": 0.5304615384615385,
      "ctd_std": 0.11868310946959883,
      "bstd_mean": 0.1323728821434029,
      "bstd_std": 0.024961354014108733
    },
    {
      "variant": "only_last_k_3",
      "history_mode": "only_last_k",
      "history_periods": 3.0,
      "landmark": 9,
      "pred_horizon": 1,
      "eligible_n_mean": 12.0,
      "eligible_n_std": 0.7071067811865476,
      "future_event_n_mean": 0.6,
      "future_event_n_std": 0.5477225575051661,
      "ctd_mean": 0.2929292929292929,
      "ctd_std": 0.03499092540543186,
      "bstd_mean": 0.05443001317599513,
      "bstd_std": 0.032121630386752864
    },
    {
      "variant": "only_last_k_3",
      "history_mode": "only_last_k",
      "history_periods": 3.0,
      "landmark": 9,
      "pred_horizon": 3,
      "eligible_n_mean": 12.0,
      "eligible_n_std": 0.7071067811865476,
      "future_event_n_mean": 2.4,
      "future_event_n_std": 0.8944271909999159,
      "ctd_mean": 0.6284415449043048,
      "ctd_std": 0.36282428839240727,
      "bstd_mean": 1.003205360773062,
      "bstd_std": 1.029601444302904
    }
  ],
  "overall": [
    {
      "variant": "exclude_last_k_1",
      "history_mode": "exclude_last_k",
      "history_periods": 1.0,
      "ctd_mean": 0.562460105172962,
      "ctd_std": 0.28484509688069176,
      "bstd_mean": 0.2902704010954265,
      "bstd_std": 0.5869274390720013
    },
    {
      "variant": "exclude_last_k_2",
      "history_mode": "exclude_last_k",
      "history_periods": 2.0,
      "ctd_mean": 0.5886313797003663,
      "ctd_std": 0.2831524150139996,
      "bstd_mean": 0.32779724792237536,
      "bstd_std": 0.7190738989202539
    },
    {
      "variant": "exclude_last_k_3",
      "history_mode": "exclude_last_k",
      "history_periods": 3.0,
      "ctd_mean": 0.5699779174852602,
      "ctd_std": 0.29552577292427845,
      "bstd_mean": 0.293982752674076,
      "bstd_std": 0.5887669060190829
    },
    {
      "variant": "full",
      "history_mode": "full",
      "history_periods": 0.0,
      "ctd_mean": 0.5720749410983766,
      "ctd_std": 0.2689919745489672,
      "bstd_mean": 0.3067672080503753,
      "bstd_std": 0.6581681353447077
    },
    {
      "variant": "only_last_k_1",
      "history_mode": "only_last_k",
      "history_periods": 1.0,
      "ctd_mean": 0.5343340161439963,
      "ctd_std": 0.30223699892494665,
      "bstd_mean": 0.3187057101775247,
      "bstd_std": 0.6744707037073762
    },
    {
      "variant": "only_last_k_2",
      "history_mode": "only_last_k",
      "history_periods": 2.0,
      "ctd_mean": 0.49546362051175646,
      "ctd_std": 0.30780080231446877,
      "bstd_mean": 0.32968821966747724,
      "bstd_std": 0.7054464056794983
    },
    {
      "variant": "only_last_k_3",
      "history_mode": "only_last_k",
      "history_periods": 3.0,
      "ctd_mean": 0.5180429944376069,
      "ctd_std": 0.27895170447884876,
      "bstd_mean": 0.30871643098862267,
      "bstd_std": 0.6278262994933724
    }
  ]
}

artifacts/env_time_focus_period_ms_full5/clean_summary.md

## 6->1

- full: Ctd=0.5385, BStd=0.0422, eligible_n=14.0, future_event_n=0.6
- attention enrichment ??: last_1_period(1.173), periods_4_6(1.003), periods_2_3(0.910)
- occlusion ?risk ??: periods_4_6(0.0076), last_1_period(0.0072), periods_2_3(0.0038)
- permutation ?risk ??: last_1_period(0.0002), periods_4_6(0.0001), periods_2_3(0.0001)
- only_last_k ??: only_last_k_3: Ctd=0.5385, BStd=0.0449, only_last_k_1: Ctd=0.5128, BStd=0.0465, only_last_k_2: Ctd=0.5128, BStd=0.0468
- exclude_last_k ??: exclude_last_k_1: Ctd=0.5641, BStd=0.0444, exclude_last_k_2: Ctd=0.5385, BStd=0.0460, exclude_last_k_3: Ctd=0.5385, BStd=0.0452

## 6->3

- full: Ctd=0.5625, BStd=0.1331, eligible_n=14.0, future_event_n=2.0
- attention enrichment ??: last_1_period(1.173), periods_4_6(1.003), periods_2_3(0.910)
- occlusion ?risk ??: periods_4_6(0.0230), last_1_period(0.0155), periods_2_3(0.0127)
- permutation ?risk ??: last_1_period(0.0002), periods_2_3(0.0002), periods_4_6(0.0001)
- only_last_k ??: only_last_k_3: Ctd=0.5305, BStd=0.1324, only_last_k_1: Ctd=0.5277, BStd=0.1398, only_last_k_2: Ctd=0.4980, BStd=0.1378
- exclude_last_k ??: exclude_last_k_1: Ctd=0.5682, BStd=0.1310, exclude_last_k_2: Ctd=0.5579, BStd=0.1376, exclude_last_k_3: Ctd=0.5499, BStd=0.1321

## 9->1

- full: Ctd=0.4167, BStd=0.0581, eligible_n=12.0, future_event_n=0.6
- attention enrichment ??: periods_7_plus(1.113), last_1_period(1.107), periods_4_6(0.991), periods_2_3(0.790)
- occlusion ?risk ??: periods_7_plus(0.0142), periods_4_6(0.0072), periods_2_3(0.0033), last_1_period(0.0018)
- permutation ?risk ??: periods_7_plus(0.0002), last_1_period(0.0001), periods_2_3(0.0001), periods_4_6(0.0001)
- only_last_k ??: only_last_k_1: Ctd=0.4470, BStd=0.0590, only_last_k_3: Ctd=0.2929, BStd=0.0544, only_last_k_2: Ctd=0.2348, BStd=0.0533
- exclude_last_k ??: exclude_last_k_2: Ctd=0.4722, BStd=0.0560, exclude_last_k_3: Ctd=0.3712, BStd=0.0504, exclude_last_k_1: Ctd=0.2929, BStd=0.0517

## 9->3

- full: Ctd=0.6951, BStd=0.9937, eligible_n=12.0, future_event_n=2.4
- attention enrichment ??: periods_7_plus(1.113), last_1_period(1.107), periods_4_6(0.991), periods_2_3(0.790)
- occlusion ?risk ??: periods_7_plus(0.0335), periods_4_6(0.0169), periods_2_3(0.0094), last_1_period(0.0046)
- permutation ?risk ??: periods_7_plus(0.0002), last_1_period(0.0002), periods_2_3(0.0002), periods_4_6(0.0001)
- only_last_k ??: only_last_k_2: Ctd=0.6389, BStd=1.0808, only_last_k_3: Ctd=0.6284, BStd=1.0032, only_last_k_1: Ctd=0.6063, BStd=1.0296
- exclude_last_k ??: exclude_last_k_3: Ctd=0.7282, BStd=0.9482, exclude_last_k_2: Ctd=0.7193, BStd=1.0716, exclude_last_k_1: Ctd=0.7175, BStd=0.9340